{
	"$schema": "./schema.json",
	"id": "level1-de-basic",
	"title": {
		"en": "Delete to the end of a word",
		"ja": "単語の末尾まで削除する"
	},
	"prompt": {
		"en": "Delete through the end of the first word, keeping the space after it.",
		"ja": "最初の単語の末尾までを削除してください。後ろの空白は残します。"
	},
	"initial": { "text": "hello world", "cursor": 0, "mode": "normal" },
	"expected": { "text": " world" },
	"constraints": { "timeLimitSec": 20 },
	"examples": ["de"],
	"tags": ["delete", "word", "de"],
	"difficulty": 1
}
